{
  "documentType": "d2p:pattern-evaluation",
  "schemaVersion": "1.0.0",
  "evaluationId": "pev_golden-tshirt-r1-size-a-regular-woven",
  "createdAt": "2026-01-02T00:00:00Z",
  "request": {
    "documentType": "d2p:evaluation-request",
    "schemaVersion": "1.0.0",
    "requestId": "erq_golden-tshirt-r1-size-a-regular-woven",
    "patternRef": {
      "artifactId": "art_golden-tshirt-pattern",
      "revisionId": "rev_golden-tshirt-pattern-r1"
    },
    "evaluatorProfile": {
      "id": "d2p:golden-fixture-analytic",
      "version": "1.0.0"
    },
    "gradingRuleSetRef": {
      "artifactId": "art_golden-tshirt-grading-rule-set",
      "revisionId": "rev_golden-tshirt-grading-rule-set-r1"
    },
    "sizeSystemRef": {
      "artifactId": "art_golden-tshirt-size-system",
      "revisionId": "rev_golden-tshirt-size-system-r1"
    },
    "fitProfileRef": {
      "artifactId": "art_golden-tshirt-fit-profile-regular",
      "revisionId": "rev_golden-tshirt-fit-profile-regular-r1"
    },
    "garmentMeasurementSpecRef": {
      "artifactId": "art_golden-tshirt-garment-measurement-spec",
      "revisionId": "rev_golden-tshirt-garment-measurement-spec-r1"
    },
    "sizeKey": "size-a",
    "configurationKey": "regular-woven",
    "materialAssumptions": {
      "materialClass": "woven"
    },
    "toleranceProfile": {
      "id": "d2p:golden-tshirt-2d",
      "version": "1.0.0"
    },
    "validationProfile": {
      "id": "d2p:sample-cut",
      "version": "1.0.0"
    },
    "requestedOutputs": [
      "fit-evaluation-report",
      "geometry-snapshot",
      "measurement-report",
      "validation-report"
    ]
  },
  "evaluator": {
    "engineId": "golden-fixture",
    "engineVersion": "1.0.0",
    "algorithmProfileVersion": "1.0.0",
    "evaluatorProfile": {
      "id": "d2p:golden-fixture-analytic",
      "version": "1.0.0"
    }
  },
  "featureSetVersion": "1.0.0",
  "inputDigests": [
    {
      "role": "fit-profile",
      "artifactRef": {
        "artifactId": "art_golden-tshirt-fit-profile-regular",
        "revisionId": "rev_golden-tshirt-fit-profile-regular-r1"
      },
      "digest": "sha256:b3e83ec409b680ec29ba3597976f1081133f87b14fdfeea9cd84e2e7826ddd46"
    },
    {
      "role": "garment-measurement-spec",
      "artifactRef": {
        "artifactId": "art_golden-tshirt-garment-measurement-spec",
        "revisionId": "rev_golden-tshirt-garment-measurement-spec-r1"
      },
      "digest": "sha256:82fdc914a640b0cef99e956f20bf931e1f6328dee5828813dc4fa8aa7dadb219"
    },
    {
      "role": "grading-rule-set",
      "artifactRef": {
        "artifactId": "art_golden-tshirt-grading-rule-set",
        "revisionId": "rev_golden-tshirt-grading-rule-set-r1"
      },
      "digest": "sha256:5754eca2347369aefca12b2414dd69659081b88c058b4db2f2923e513189e9d8"
    },
    {
      "role": "material-assumptions",
      "digest": "sha256:b2d14743b5b88f5e6116d3d241dfd11cefd44ef638867100dfe8e0c32e5959fc"
    },
    {
      "role": "measurement-definition-registry",
      "id": {
        "id": "d2p:measurement-definitions",
        "version": "1.0.0"
      },
      "digest": "sha256:c4026449780808e4fa4b9d1f3b0ed8d02e1b63fc7ee6512193b302e7ea4eb4fd"
    },
    {
      "role": "pattern",
      "artifactRef": {
        "artifactId": "art_golden-tshirt-pattern",
        "revisionId": "rev_golden-tshirt-pattern-r1"
      },
      "digest": "sha256:ef7edb92161d6db884d89db7b16baac1e1432e26e9d9ff1f1a1ce23649eb6949"
    },
    {
      "role": "size-system",
      "artifactRef": {
        "artifactId": "art_golden-tshirt-size-system",
        "revisionId": "rev_golden-tshirt-size-system-r1"
      },
      "digest": "sha256:57d8493744de25f3eec5792e75cbc89b1fb0f11223ad9b8ffde542027a5d94cc"
    },
    {
      "role": "tolerance-profile",
      "id": {
        "id": "d2p:golden-tshirt-2d",
        "version": "1.0.0"
      },
      "digest": "sha256:8a6da5f9232d68927dfaa99d5ea23219df6bb4d7a311f77947a497c1ad1564e9"
    },
    {
      "role": "validation-profile",
      "id": {
        "id": "d2p:sample-cut",
        "version": "1.0.0"
      },
      "digest": "sha256:abddc6507c20c4ce8d28e6ba4582ab409d9966055ab16c3739993264dc313e51"
    }
  ],
  "status": "succeeded",
  "constraintStatus": "solved",
  "snapshotRef": {
    "id": "snp_golden-tshirt-r1-size-a-regular-woven",
    "digest": "sha256:ac0f22fabde5d2155632e430ba4e019d15b06766fc3231838100c376f49dbd72"
  },
  "measurements": [
    {
      "key": "target-chest-girth-size-a-regular-woven",
      "definitionId": "d2p:garment.chest-girth",
      "value": 1020,
      "unit": "mm"
    },
    {
      "key": "target-sleeve-length-size-a-regular-woven",
      "definitionId": "d2p:garment.sleeve-length",
      "value": 197.991012623,
      "unit": "mm"
    }
  ],
  "diagnostics": [],
  "resultDigest": "sha256:387f0d96525a8aa6cf143051b2b4d168811db52e6256f120fd4ea4c1c14cac7e"
}
